{"$schema":"https://json-schema.org/draft/2020-12/schema","title":"Teaching case shape (documentation schema)","type":"object","required":["schema_version","case_id","title","units","actors","baseline","candidate","constraints"],"properties":{"schema_version":{"const":"coop.case.v0.1"},"case_id":{"type":"string"},"title":{"type":"string"},"units":{"type":"object"},"actors":{"type":"array"},"baseline":{"type":"object"},"candidate":{"type":"object"},"constraints":{"type":"array"},"notes":{"type":"string"}},"additionalProperties":false}
