{"schema_version":"coop.case.v0.1","case_id":"BYOP-ACQ-MINORITY","title":"Synthetic supplier case - minority investment plus joint capacity","units":{"cost":"CU","time":"DAY","people":"PERSON"},"actors":[{"id":"M","role":"manufacturer"},{"id":"S","role":"supplier"},{"id":"E","role":"affected-employee-group"},{"id":"C","role":"downstream-customer-group"}],"baseline":{"allocations":{},"outcomes":[{"actor":"M","dimension":"annual_procurement_cost","unit":"CU","value":100},{"actor":"M","dimension":"supply_interruption_exposure","unit":"DAY","value":20},{"actor":"S","dimension":"financing_burden","unit":"CU","value":30},{"actor":"E","dimension":"involuntary_displacement","unit":"PERSON","value":0},{"actor":"C","dimension":"delivery_delay","unit":"DAY","value":10}]},"candidate":{"allocations":{},"outcomes":[{"actor":"M","dimension":"annual_procurement_cost","unit":"CU","value":95},{"actor":"M","dimension":"supply_interruption_exposure","unit":"DAY","value":6},{"actor":"S","dimension":"financing_burden","unit":"CU","value":18},{"actor":"E","dimension":"involuntary_displacement","unit":"PERSON","value":null},{"actor":"C","dimension":"delivery_delay","unit":"DAY","value":4}]},"constraints":[{"id":"EMPLOYEE-TRANSITION","kind":"outcome","description":"Synthetic employee displacement protection <= 50 PERSON","actor":"E","dimension":"involuntary_displacement","unit":"PERSON","operator":"<=","limit":50,"hard":true},{"id":"CUSTOMER-CONTINUITY","kind":"outcome","description":"Synthetic downstream delivery delay <= 7 DAY","actor":"C","dimension":"delivery_delay","unit":"DAY","operator":"<=","limit":7,"hard":true}],"notes":"Synthetic BYOP teaching fixture. Employee displacement is intentionally UNKNOWN to demonstrate that a candidate can remain unresolved. Values and thresholds are invented for mechanism demonstration only."}
