{"schema_version":"coop.case.v0.1","case_id":"BYOP-ACQ-CONTRACT","title":"Synthetic supplier case - long-term supply agreement","units":{"cost":"CU","time":"DAY","people":"PERSON"},"actors":[{"id":"M","role":"manufacturer"},{"id":"S","role":"supplier"},{"id":"E","role":"affected-employee-group"},{"id":"C","role":"downstream-customer-group"}],"baseline":{"allocations":{},"outcomes":[{"actor":"M","dimension":"annual_procurement_cost","unit":"CU","value":100},{"actor":"M","dimension":"supply_interruption_exposure","unit":"DAY","value":20},{"actor":"S","dimension":"financing_burden","unit":"CU","value":30},{"actor":"E","dimension":"involuntary_displacement","unit":"PERSON","value":0},{"actor":"C","dimension":"delivery_delay","unit":"DAY","value":10}]},"candidate":{"allocations":{},"outcomes":[{"actor":"M","dimension":"annual_procurement_cost","unit":"CU","value":92},{"actor":"M","dimension":"supply_interruption_exposure","unit":"DAY","value":8},{"actor":"S","dimension":"financing_burden","unit":"CU","value":20},{"actor":"E","dimension":"involuntary_displacement","unit":"PERSON","value":10},{"actor":"C","dimension":"delivery_delay","unit":"DAY","value":5}]},"constraints":[{"id":"EMPLOYEE-TRANSITION","kind":"outcome","description":"Synthetic employee displacement protection <= 50 PERSON","actor":"E","dimension":"involuntary_displacement","unit":"PERSON","operator":"<=","limit":50,"hard":true},{"id":"CUSTOMER-CONTINUITY","kind":"outcome","description":"Synthetic downstream delivery delay <= 7 DAY","actor":"C","dimension":"delivery_delay","unit":"DAY","operator":"<=","limit":7,"hard":true}],"notes":"Synthetic BYOP teaching fixture. Values and thresholds are invented for mechanism demonstration only; not empirical acquisition evidence or advice."}
