{"schema_version":"coop.case.v0.1","case_id":"TEACH-EQUIP-CAPACITY-VIOLATION","title":"Shared equipment - resource capacity violated","units":{"slot":"TU","cost":"CU"},"actors":[{"id":"A","role":"primary-user"},{"id":"B","role":"primary-user"},{"id":"C","role":"third-party-reserved-user"}],"baseline":{"allocations":{"equipment_slots":10},"outcomes":[{"actor":"A","dimension":"ordinary_cost","unit":"CU","value":8},{"actor":"B","dimension":"ordinary_cost","unit":"CU","value":8},{"actor":"C","dimension":"reserved_slot_loss","unit":"TU","value":0}]},"candidate":{"allocations":{"equipment_slots":11},"outcomes":[{"actor":"A","dimension":"ordinary_cost","unit":"CU","value":4},{"actor":"B","dimension":"ordinary_cost","unit":"CU","value":4},{"actor":"C","dimension":"reserved_slot_loss","unit":"TU","value":0.5}]},"constraints":[{"id":"R-CAP","kind":"resource","description":"At most 10 equipment slots","resource":"equipment_slots","operator":"<=","limit":10,"hard":true},{"id":"THIRD-PARTY","kind":"outcome","description":"Third-party reserved-slot loss <= 1 TU","actor":"C","dimension":"reserved_slot_loss","unit":"TU","operator":"<=","limit":1,"hard":true}],"notes":"Same-class DEV-2 extension case; no core-code special casing."}
